{
  "requestId": "req-agentmail-001",
  "requestedBy": "automind-host",
  "mailboxId": "bmo-tron-agentmail",
  "operation": "send",
  "approvalMode": "prompt",
  "payload": {
    "to": [
      "operator@prismtek.dev"
    ],
    "subject": "BMO runtime mailbox verification",
    "bodyText": "Confirm mailbox provisioning and runtime approval boundaries before first live send."
  },
  "metadata": {
    "intent": "verification",
    "origin": "runtime-owner-review"
  }
}
